{
  "title": "TwoBR Test Brief",
  "unit": "ft",
  "areaUnit": "sqft",
  "targetArea": { "value": 1000 },
  "constraints": {
    "mustShareWetWalls": true,
    "requireWindowInEveryBedroom": true
  },
  "rooms": [
    { "name": "Foyer", "kind": "entry" },
    { "name": "LivingRoom", "kind": "living" },
    { "name": "Kitchen", "kind": "kitchen" },
    { "name": "Bedroom2", "kind": "bedroom", "label": "Bedroom 2" },
    { "name": "MasterBedroom", "kind": "bedroom", "label": "Master" },
    { "name": "HallBath", "kind": "bathroom", "label": "Hall Bath" },
    { "name": "MasterBath", "kind": "bathroom", "label": "Ensuite" },
    { "name": "Hall", "kind": "hallway" }
  ]
}
